{
  "specversion": "1.0",
  "id": "5b1f0c3e-8f7a-4f5e-9d2c-3a4b5c6d7e8f",
  "source": "//prismatic-hq/caldera/golden-image",
  "type": "com.prismatichq.data.golden.built.v1",
  "subject": "dataset/ds-0123abcd",
  "time": "2026-09-26T12:00:00Z",
  "datacontenttype": "application/json",
  "dataschema": "https://github.com/prismatic-hq/caldera-platform/blob/main/contracts/events/data/data.golden.built.v1.schema.json",
  "data": {
    "datasetVersion": "ds-0123abcd",
    "image": "golden-db:ds-0123abcd",
    "seederDigest": "0000000000000000000000000000000000000000000000000000000000000000",
    "alembicHeads": {
      "tremor": "0001",
      "steward": "0001"
    },
    "checksums": {
      "tremor.alerts": "aaaaaaaaaaaaaaaaaaaaaaaaaaaaaaaaaaaaaaaaaaaaaaaaaaaaaaaaaaaaaaaa",
      "steward.work_orders": "bbbbbbbbbbbbbbbbbbbbbbbbbbbbbbbbbbbbbbbbbbbbbbbbbbbbbbbbbbbbbbbb"
    },
    "compressedBytes": 41943040
  }
}
