{
  "specversion": "1.0",
  "id": "5b1f0c3e-8f7a-4f5e-9d2c-3a4b5c6d7e8f",
  "source": "//prismatic-hq/caldera/cli",
  "type": "com.prismatichq.test.e2e.completed.v1",
  "subject": "vent/quake-alerts",
  "time": "2026-09-26T12:00:00Z",
  "datacontenttype": "application/json",
  "dataschema": "https://github.com/prismatic-hq/caldera-platform/blob/main/contracts/events/data/test.e2e.completed.v1.schema.json",
  "data": {
    "vent": "quake-alerts",
    "result": "passed",
    "passed": 12,
    "failed": 0,
    "durationSeconds": 9.4
  }
}
