{
  "specversion": "1.0",
  "id": "5b1f0c3e-8f7a-4f5e-9d2c-3a4b5c6d7e8f",
  "source": "//prismatic-hq/caldera/cli",
  "type": "com.prismatichq.preview.environment.requested.v1",
  "subject": "preview-environment/quake-alerts",
  "time": "2026-09-26T12:00:00Z",
  "datacontenttype": "application/json",
  "dataschema": "https://github.com/prismatic-hq/caldera-platform/blob/main/contracts/events/data/preview.environment.requested.v1.schema.json",
  "data": {
    "environment": "quake-alerts",
    "repo": "tremor-api",
    "branch": "feature/quake-alerts",
    "sha": "a1b2c3d",
    "services": {
      "tremor": {
        "ref": "feature/quake-alerts",
        "image": "tremor-api:sha-a1b2c3d"
      },
      "steward": {
        "ref": "main",
        "image": "steward-api:sha-0f9e8d7"
      }
    },
    "datasetVersion": "ds-0123abcd"
  }
}
